score,fit_category,title,company,location,date_posted,date_found,source,url,rationale,key_matches,key_gaps,status,feedback
88,strong,Senior AI Architect (Systems & Algorithms),imec the Netherlands,"Eindhoven, North Brabant, Netherlands",nan,2026-04-02T15:25:20.439610,linkedin,https://www.linkedin.com/jobs/view/4382588088,Senior AI Architect (Systems & Algorithms) at imec NL in Eindhoven — directly in Ben's current employer domain with perfect skill overlap in AI systems and algorithm design.,imec; systems & algorithms; AI architecture; Eindhoven; research institute,seniority may be higher than postdoc,new,1
72,strong,Sensing Architect (hardware & algorithm),TMC,"Eindhoven, NB, NL",2026-03-31,2026-04-02T15:25:20.422509,indeed,https://nl.indeed.com/viewjob?jk=34aa2427605fd213,"Sensing Architect (hardware & algorithm) at TMC Eindhoven — excellent match: sensor system design + algorithm development, core of Ben's imec work.",sensing architecture; hardware+algorithm; Eindhoven; sensor systems; TMC,consulting/contracting nature,new,1
70,strong,Agentic & Generative Edge AI Optimization Engineer,ENTER BV,"Eindhoven, North Brabant, Netherlands",nan,2026-04-08T05:00:12.272803,linkedin,https://www.linkedin.com/jobs/view/4386542283,"The role aligns well with Ben's experience in AI and embedded systems, but lacks a direct connection to his neuroscience expertise.",Experience in AI and embedded systems; Focus on optimizing AI models for edge deployment; Multidisciplinary environment,Lack of direct neuroscience application; Emphasis on large language models rather than spiking neural networks,new,0
70,strong,Senior Deep Learning Researcher – Physical AI - Qualcomm - Amsterdam,Qualcomm,"Amsterdam, North Holland, Netherlands",nan,2026-04-08T05:00:12.249912,linkedin,https://www.linkedin.com/jobs/view/4395443571,"The role aligns well with Ben's expertise in AI and robotics, but the emphasis on business impact and humanoid robotics presents some gaps.",Deep learning research; Robotics and embodied AI; Multimodal sensing,Lack of direct experience in humanoid robotics; Focus on business impact may not align with academic research interests,new,0
70,strong,Senior Deep Learning Researcher – Model Efficiency - Qualcomm - Amsterdam,Qualcomm,"Amsterdam, North Holland, Netherlands",nan,2026-04-04T04:45:44.361240,linkedin,https://www.linkedin.com/jobs/view/4324377664,"The role aligns well with Ben's programming and deep learning skills, but the focus on model efficiency diverges from his primary neuroscience interests.",Experience in deep learning and machine learning research; Programming experience in Python and hands-on experience with PyTorch; Opportunity to work on cutting-edge projects in AI,Focus on model efficiency may not align directly with systems neuroscience; Less emphasis on neuroscience applications,new,0
70,strong,Head of Software & AI Engineering - AzurionEye,Philips,"Best, NB, NL",2026-04-03,2026-04-04T04:45:44.341792,indeed,https://nl.indeed.com/viewjob?jk=531430f9dd86cc26,"The role aligns well with Ben's leadership and AI experience, but the focus on medical imaging and people management presents some gaps.",Leadership in AI and software engineering; Experience in regulated environments (medical devices); Collaboration with cross-functional teams,Lack of direct experience in medical imaging; Focus on people management rather than technical R&D,new,0
70,strong,Senior Machine Learning Engineer - ADAS,TomTom,"Amsterdam, North Holland, Netherlands",nan,2026-04-03T04:56:27.582830,linkedin,https://www.linkedin.com/jobs/view/4393812178,"The role aligns well with Ben's machine learning and computational skills, but it primarily focuses on computer vision for autonomous vehicles, which is a slight divergence from his core expertise in systems neuroscience.",machine learning applications; computer vision; collaborate with cross-functional teams,focus on autonomous vehicles; not directly related to systems neuroscience,new,0
70,strong,Manager Application Software Engineering,Xsens,"Enschede, OV, NL",2026-04-02,2026-04-02T17:47:47.728910,indeed,https://nl.indeed.com/viewjob?jk=e97955ecef3735cb,"The role aligns well with Ben's programming and leadership skills, but it diverges from his primary domain of systems neuroscience.",strong programming skills; experience in AI and real-time systems; leadership and team management,focus on human motion data rather than neuroscience; not directly related to systems neuroscience or neuroengineering,new,0
68,moderate,Audio signal processing and coding supporting standardisation,Philips,"Eindhoven, North Brabant, Netherlands",2026-03-31,2026-04-02T15:25:20.425933,linkedin,https://www.linkedin.com/jobs/view/4376742150,Audio signal processing and standardisation R&D at Philips Eindhoven — strong DSP/algorithm overlap even if domain is audio rather than neural.,audio signal processing; standardisation; Philips Eindhoven; DSP; algorithm development,audio domain not neuroscience,new,-1
62,moderate,Postdoc on Robot World Models (UvA+TOYOTA),University of Amsterdam,"Amsterdam, North Holland, Netherlands",2026-03-30,2026-04-02T15:25:20.457229,linkedin,https://www.linkedin.com/jobs/view/4382942962,"Postdoc on Robot World Models (UvA+TOYOTA) — robotics+AI world modelling at UvA with Toyota; strong AI/computational modelling overlap, good alignment for broadened scope.",robot world models; AI; UvA; Toyota research; computational modelling,robotics not neuro; postdoc level,new,-1
62,moderate,Hardware Full Stack Developer,Next Generation Sensors B.V.,"Maastricht, Limburg, Netherlands",2026-03-31,2026-04-02T15:25:20.434677,linkedin,https://www.linkedin.com/jobs/view/4392415573,Hardware Full Stack Developer at Next Generation Sensors — company name and hardware+sensing alignment are promising; Maastricht is secondary location.,hardware full-stack; sensor systems; Next Generation Sensors,Maastricht location; no description available,new,-1
52,moderate,Embedded Software Engineer,Darwin Recruitment,"Delft, South Holland, Netherlands",nan,2026-04-02T15:25:20.467422,linkedin,https://www.linkedin.com/jobs/view/4393038021,"Embedded Software Engineer in Delft — core embedded skills apply; no description so domain unknown, likely industrial embedded without neuro angle.",embedded software; Delft; engineering,"embedded-only, no neuro/AI angle",new,1
52,moderate,Calibration Algorithm Engineer,TMC,"Eindhoven, NB, NL",2026-03-31,2026-04-02T15:25:20.420634,indeed,https://nl.indeed.com/viewjob?jk=ffa7a751e3628b50,"Calibration Algorithm Engineer at TMC Eindhoven — solid algorithm + sensing fit, good location; calibration specialisation is a partial overlap.",calibration algorithms; signal processing; Eindhoven; TMC,calibration not core interest,new,-1
52,moderate,Staff Program Manager,Innatera,"Rijswijk, South Holland, Netherlands",nan,2026-04-02T15:25:20.362293,linkedin,https://www.linkedin.com/jobs/view/4397038853,Staff Program Manager at Innatera — Innatera is a neuromorphic chip startup directly in Ben's domain; PM role is a career shift but the company fit is exceptional.,Innatera neuromorphic chip company; Netherlands,program manager role not technical; non-research position,new,-1
52,moderate,Staff Program Manager,Innatera Nanosystems,"Rijswijk, ZH, NL",2026-04-02,2026-04-02T15:25:20.356943,indeed,https://nl.indeed.com/viewjob?jk=0fd04699a6fd6a8e,"Staff Program Manager at Innatera Nanosystems — same as above, Indeed version.",Innatera neuromorphic chip company; Netherlands,program manager role not technical; non-research position,new,-1
50,moderate,Computer Vision Scientist/Data Scientist,Harnham,"The Randstad, Netherlands",nan,2026-04-08T05:00:12.267542,linkedin,https://www.linkedin.com/jobs/view/4377129839,"While there are relevant skills in Python and machine learning, the focus on computer vision and lack of direct neuroscience application creates a moderate fit.",Strong programming skills in Python; Experience with machine learning frameworks like PyTorch; Ability to work independently in a fast-paced environment,Lack of direct experience in computer vision; Role primarily focused on AI and not directly related to systems neuroscience,new,0
50,moderate,AI/ML Multimodal Data Scientist (m/w/d),dsm-firmenich,"Delft, South Holland, Netherlands",nan,2026-04-08T05:00:12.247447,linkedin,https://www.linkedin.com/jobs/view/4384081187,"While the role involves AI/ML and data analysis, it lacks a direct connection to systems neuroscience, which is Ben's primary expertise.",AI/ML integration; multimodal data analysis; biological insights,lack of direct neuroscience application; focus on health and nutrition rather than systems neuroscience,new,0
50,moderate,Senior ML Engineer – Agentic AI,kaiko.ai,"Amsterdam, North Holland, Netherlands",nan,2026-04-05T05:00:21.355552,linkedin,https://www.linkedin.com/jobs/view/4397822907,"While there are relevant skills in Python and AI, the role's focus on healthcare and lack of direct neuroscience application creates a moderate fit.",Strong Python skills; Experience with AI and machine learning; Collaboration with research centers,Lack of direct neuroscience application; Focus on healthcare rather than systems neuroscience,new,0
50,moderate,Software Engineer,ALTEN Nederland,"Eindhoven, North Brabant, Netherlands",nan,2026-04-04T04:45:44.349867,linkedin,https://www.linkedin.com/jobs/view/4306740436,"The role has some relevant skills but lacks a direct connection to systems neuroscience, making it a moderate fit.",Experience with MATLAB; Proficiency in Python; Data analysis and algorithm development,Lack of direct neuroscience application; Focus on optics and semiconductor physics rather than systems neuroscience,new,0
50,moderate,AI Engineer,EY,"Amsterdam, North Holland, Netherlands",nan,2026-04-04T04:45:44.347533,linkedin,https://www.linkedin.com/jobs/view/4384249734,"While there are relevant programming and AI skills, the role lacks a direct connection to neuroscience and may not align with Ben's research interests.","Strong programming skills in Python; Experience with ML frameworks (TensorFlow, PyTorch); Familiarity with cloud platforms",Lack of direct neuroscience application; Focus on business value rather than research,new,0
50,moderate,Senior Data Scientist I,Elsevier,"Amsterdam, North Holland, Netherlands",nan,2026-04-04T04:45:44.336099,linkedin,https://www.linkedin.com/jobs/view/4394203514,"While there are relevant skills in Python and machine learning, the role's focus on data science and NLP lacks direct alignment with Ben's expertise in systems neuroscience.",Python programming; Machine Learning expertise; Data science project leadership,Lack of direct neuroscience application; Focus on GenAI and NLP rather than systems neuroscience,new,0
50,moderate,AI Engineer,MarvelX AI,"Amsterdam, North Holland, Netherlands",2026-04-01,2026-04-03T04:56:27.586683,linkedin,https://www.linkedin.com/jobs/view/4392849582,"While Ben has relevant skills in AI and systems design, the focus on LLMs and the specific industry application create a moderate fit.",Strong background in Python; Experience with ML frameworks (PyTorch); Ability to design and build systems,Lack of specific experience in LLMs and agentic architectures; Domain mismatch with insurance and banking,new,0
50,moderate,Research Engineer In Open-Source Machine Learning,Eindhoven University of Technology,"Eindhoven, North Brabant, Netherlands",nan,2026-04-03T04:56:27.584218,linkedin,https://www.linkedin.com/jobs/view/4390354736,"While the position involves relevant skills in software engineering and machine learning, it lacks a direct connection to Ben's primary domain of systems neuroscience and neuromorphic computing.",open-source software; machine learning; collaboration with scientific community,lack of direct relevance to systems neuroscience; focus on open data rather than neuromorphic computing,new,0
50,moderate,AI Engineer,IBM,"Groningen, Groningen, Netherlands",nan,2026-04-02T16:12:00.363671,linkedin,https://www.linkedin.com/jobs/view/4382702764,"While there are relevant skills in Python and AI, the role's focus on software engineering and lack of direct neuroscience application creates a moderate fit.",Python; ML/AI solutions; cloud-native development practices,No direct experience in AI operationalization; Focus on software engineering rather than neuroscience,new,-1
48,stretch,Senior Analog Electronic Engineer,Manus Machinae B.V.,"Geldrop, NB, NL",2026-04-02,2026-04-02T15:25:20.399274,indeed,https://nl.indeed.com/viewjob?jk=8553e86823ccbadb,Senior Analog Electronic Engineer at Manus Machinae — Manus makes haptic/motion-capture gloves; analog hardware for human-machine interfaces is tangentially relevant.,analog electronics; hardware; sensor systems adjacent,analog IC focus; Geldrop; no neuroscience,new,-1
48,stretch,Medior Embedded Software Engineer,Manus Machinae B.V.,"Geldrop, NB, NL",2026-04-02,2026-04-02T15:25:20.397567,indeed,https://nl.indeed.com/viewjob?jk=a509bb05cecb28e4,Medior Embedded Software Engineer at Manus Machinae — same Manus haptic gloves context; embedded SW at a neuro-adjacent hardware company.,embedded software; hardware company; human-machine interface,not neuroscience-focused; Geldrop,new,-1
45,stretch,Postdoc project: Neuron-glia interactions in memory,Vrije Universiteit Amsterdam,"Amsterdam Zuid, NH, NL",2026-04-01,2026-04-02T15:25:20.465349,indeed,https://nl.indeed.com/viewjob?jk=9ea3ed51bf3020a0,"Postdoc Neuron-glia interactions in memory at VU Amsterdam — neuroscience postdoc but molecular/cellular focus, not systems or computational.",neuroscience; postdoc; VU Amsterdam,neuron-glia molecular focus; not computational/systems,new,1
45,stretch,Postdoc project: Neuron-glia interactions in memory,Vrije Universiteit Amsterdam (VU Amsterdam),"Amsterdam, North Holland, Netherlands",2026-04-01,2026-04-02T15:25:20.447886,linkedin,https://www.linkedin.com/jobs/view/4393976528,Same neuron-glia postdoc at VU Amsterdam — LinkedIn version.,neuroscience; postdoc; VU Amsterdam,neuron-glia molecular focus; not computational/systems,new,1
45,stretch,Postdoc project: Neuron-glia interactions in memory,Athena - Research and Education Institute,"Amsterdam, North Holland, Netherlands",2026-04-01,2026-04-02T15:25:20.444143,linkedin,https://www.linkedin.com/jobs/view/4396263534,"Neuron-glia postdoc at Athena — same position, different listing.",neuroscience; postdoc; Amsterdam,molecular focus; not computational/systems,new,1
42,stretch,Applied Scientist / Research Engineer - Multimodal (Come to Singapore),Mistral AI,"Amsterdam, North Holland, Netherlands",nan,2026-04-02T15:25:20.471893,linkedin,https://www.linkedin.com/jobs/view/4394985242,"Applied Scientist/Research Engineer Multimodal at Mistral AI — strong AI research role but posted for Singapore, not Netherlands.",multimodal AI; research role; Amsterdam,Singapore location; LLM focus not neuro; no description,new,-1
42,stretch,Research Assistant at the Donders Centre for Cognition,Radboud University,"Nijmegen, Gelderland, Netherlands",2026-04-01,2026-04-02T15:25:20.428870,linkedin,https://www.linkedin.com/jobs/view/4394660683,"Research Assistant at Donders Centre for Cognition Radboud — prestigious neuroscience institute; RA level is below Ben's qualification, but domain overlap is good.",Donders Centre; cognitive neuroscience; Radboud; Nijmegen,research assistant level; overqualified; no description,new,-1
42,stretch,Research Assistant at the Donders Centre for Cognition,Radboud Universiteit,"Nijmegen, GE, NL",2026-04-01,2026-04-02T15:25:20.360359,indeed,https://nl.indeed.com/viewjob?jk=62e5aa4814da7240,Research Assistant at Donders Centre (Indeed) — same role as LinkedIn listing.,Donders Centre; cognitive neuroscience; Radboud; Nijmegen,research assistant level; overqualified,new,-1
42,stretch,Research Assistant at the Donders Centre for Cognition,Radboud Universiteit,"Nijmegen, GE, NL",2026-04-01,2026-04-02T15:25:20.358613,indeed,https://nl.indeed.com/viewjob?jk=858e07bd696d8c54,"Research Assistant at Donders Centre (Indeed, duplicate) — same position.",Donders Centre; cognitive neuroscience; Radboud; Nijmegen,research assistant level; overqualified,new,-1
38,stretch,Postdoctoral Researcher in Neuroimaging of Language- NL,Leiden University,"Leiden, South Holland, Netherlands",nan,2026-04-02T15:25:20.461980,linkedin,https://www.linkedin.com/jobs/view/4394989174,"Postdoc Neuroimaging of Language at Leiden — neuroscience but language+MRI domain, not computational systems neuro.",neuroscience; postdoc; Leiden; neuroimaging,language processing not systems neuro; clinical MRI focus,new,1
38,stretch,Postdoctoral Researcher in Neuroimaging of Language,Universiteit Leiden,"Leiden, ZH, NL",2026-04-01,2026-04-02T15:25:20.440946,indeed,https://nl.indeed.com/viewjob?jk=3fbd0e416ada2a7e,"Postdoc Neuroimaging of Language at Leiden (Indeed) — same role, Indeed listing.",neuroscience; neuroimaging; Leiden postdoc,language domain; MRI not electrophysiology,new,1
,,Senior Deep Learning Researcher – Physical AI - Qualcomm - Amsterdam,Qualcomm,"Amsterdam, NH, NL",2026-04-07,2026-04-08T05:00:12.287564,indeed,https://nl.indeed.com/viewjob?jk=c4f6ebbf2318ba4a,,,,new,0
,,Embedded Linux Field Engineer for Devices/IoT,Canonical,"Amsterdam, North Holland, Netherlands",2026-04-07,2026-04-08T05:00:12.286314,linkedin,https://www.linkedin.com/jobs/view/4398351254,,,,new,0
,,Postdoc in AI for Accessible Cardiac CT Image Analysis- NL,Amsterdam UMC,"Amsterdam, North Holland, Netherlands",nan,2026-04-08T05:00:12.285061,linkedin,https://www.linkedin.com/jobs/view/4398213477,,,,new,0
,,Postdoc position: “to trace the evolution of symbiotic lifestyles across the tree of life”,NIOZ Royal Netherlands Institute for Sea Research,"’t Horntje, North Holland, Netherlands",nan,2026-04-08T05:00:12.283785,linkedin,https://www.linkedin.com/jobs/view/4398386339,,,,new,0
,,Postdoc (2) Microbial Community Engineering for the Production of Polyhydroxyalkanoa (PHAs),Delft University of Technology,"Delft, South Holland, Netherlands",nan,2026-04-08T05:00:12.282467,linkedin,https://www.linkedin.com/jobs/view/4386906676,,,,new,0
,,Postdoctoral Researcher in Marine Microbial Ecology,University of Amsterdam,"Amsterdam, North Holland, Netherlands",nan,2026-04-08T05:00:12.281026,linkedin,https://www.linkedin.com/jobs/view/4398397715,,,,new,0
,,"Postdoc | Brain barriers in neurodegenerative diseases (36,0 hrs)- NL",Amsterdam UMC,"Amsterdam, North Holland, Netherlands",nan,2026-04-08T05:00:12.279596,linkedin,https://www.linkedin.com/jobs/view/4398220404,,,,new,0
,,Postdoc position ALS grant,UMC Utrecht,"Utrecht, Utrecht, Netherlands",nan,2026-04-08T05:00:12.278346,linkedin,https://www.linkedin.com/jobs/view/4389805440,,,,new,0
,,Postdoctoral Researcher,Leiden University Medical Center,"Leiden, South Holland, Netherlands",nan,2026-04-08T05:00:12.276983,linkedin,https://www.linkedin.com/jobs/view/4398259545,,,,new,0
,,Postdoc in AI for Accessible Cardiac CT Image Analysis,Amsterdam UMC,"Amsterdam, North Holland, Netherlands",2026-04-07,2026-04-08T05:00:12.275402,linkedin,https://www.linkedin.com/jobs/view/4398435862,,,,new,0
,,"Postdoc | Brain barriers in neurodegenerative diseases (36,0 hrs)",Amsterdam UMC,"Amsterdam, North Holland, Netherlands",2026-04-07,2026-04-08T05:00:12.274105,linkedin,https://www.linkedin.com/jobs/view/4398445857,,,,new,0
